{
  "version": 1,
  "tick_rate": 60,
  "arena": {
    "width": 100,
    "start_x_player": 30,
    "start_x_enemy": 70,
    "melee_range": 12,
    "min_distance": 8,
    "dash_distance": 20,
    "dash_time_s": 0.2,
    "approach_speed": 150,
    "approach_timeout_s": 0.6
  },
  "vigor": {
    "max": 10,
    "start": 5,
    "regen_per_s": 1.0
  },
  "hand": {
    "size": 4,
    "refill_delay_s": 1.5,
    "deck_min": 6,
    "deck_max": 10,
    "max_copies": 3,
    "max_climax": 1
  },
  "slip": {
    "cost": 2,
    "break_cost": 4,
    "iframes_s": 0.35,
    "perfect_window_s": 0.15,
    "recovery_s": 0.15,
    "perfect_refund": 2,
    "perfect_burst_gain": 5
  },
  "riposte": {
    "window_s": 0.8,
    "damage_mult": 1.25,
    "first_hit_delay_s": 0.1,
    "allowed_types": [
      "fist",
      "bolt",
      "signature"
    ]
  },
  "combo": {
    "bonus_per_card": 0.05,
    "bonus_max_steps": 4,
    "max_cards": 5,
    "buffer_s": 0.25,
    "knockdown_distance": 25,
    "getup_s": 0.6,
    "chain_burst_min_cards": 3,
    "chain_burst_gain": 5
  },
  "tag": {
    "cooldown_s": 8,
    "escape_cost": 3,
    "invuln_s": 0.5,
    "strike_power": 0.8,
    "strike_hitstun_s": 0.6,
    "strike_knockback": 4,
    "strike_first_hit_delay_s": 0.1
  },
  "ko": {
    "anim_s": 1.5,
    "incoming_invuln_s": 1.5,
    "ally_ko_burst_gain": 15
  },
  "hitstop_s": {
    "fist": 0.04,
    "bolt": 0.03,
    "signature": 0.06,
    "climax": 0
  },
  "ignition": {
    "cinematic_s": 1.5,
    "vigor_gain": 3,
    "enemy_push": 20
  },
  "burst": {
    "max": 100,
    "gain_dealt_factor": 40,
    "gain_taken_factor": 25,
    "power_per_member": 3.0,
    "rush_time_s": 0.3,
    "whiff_refund_pct": 0.5,
    "cinematic_s": 4.0,
    "uses_per_battle": 1
  },
  "damage": {
    "def_constant": 1000,
    "crit_mult": 1.5,
    "crit_cap": 0.5,
    "min_hit": 1,
    "max_hit": 99999,
    "buff_factor_min": 0.5,
    "buff_factor_max": 1.5
  },
  "timer": {
    "default_s": 180
  },
  "intro_s": 2.0,
  "tutorial_slowmo": 0.3,
  "type_chart": {
    "blaze": {
      "blaze": 1.0,
      "gale": 1.3,
      "stone": 0.8,
      "radiant": 1.0,
      "void": 1.0
    },
    "gale": {
      "blaze": 0.8,
      "gale": 1.0,
      "stone": 1.3,
      "radiant": 1.0,
      "void": 1.0
    },
    "stone": {
      "blaze": 1.3,
      "gale": 0.8,
      "stone": 1.0,
      "radiant": 1.0,
      "void": 1.0
    },
    "radiant": {
      "blaze": 1.0,
      "gale": 1.0,
      "stone": 1.0,
      "radiant": 1.0,
      "void": 1.3
    },
    "void": {
      "blaze": 1.0,
      "gale": 1.0,
      "stone": 1.0,
      "radiant": 1.3,
      "void": 1.0
    }
  },
  "ai_tiers": {
    "rookie": {
      "think_interval_s": 1.4,
      "think_jitter": 0.2,
      "reaction_s": 0.45,
      "slip_chance": 0.1,
      "perfect_slip_chance": 0.0,
      "riposte_chance": 0.0,
      "combo_continue": 0.25,
      "break_slip_chance": 0.0,
      "tag_hp_pct": 0.0,
      "climax_chance": 0.5,
      "ignite_delay_s": 4.0,
      "uses_burst": false,
      "vigor_reserve": 0,
      "aggression": 0.4,
      "preferred_distance": 30
    },
    "fighter": {
      "think_interval_s": 1.0,
      "think_jitter": 0.2,
      "reaction_s": 0.35,
      "slip_chance": 0.25,
      "perfect_slip_chance": 0.15,
      "riposte_chance": 0.5,
      "combo_continue": 0.45,
      "break_slip_chance": 0.15,
      "tag_hp_pct": 0.25,
      "climax_chance": 0.7,
      "ignite_delay_s": 2.0,
      "uses_burst": true,
      "vigor_reserve": 0,
      "aggression": 0.55,
      "preferred_distance": 25
    },
    "veteran": {
      "think_interval_s": 0.75,
      "think_jitter": 0.2,
      "reaction_s": 0.27,
      "slip_chance": 0.4,
      "perfect_slip_chance": 0.3,
      "riposte_chance": 0.8,
      "combo_continue": 0.65,
      "break_slip_chance": 0.3,
      "tag_hp_pct": 0.35,
      "climax_chance": 0.9,
      "ignite_delay_s": 1.0,
      "uses_burst": true,
      "vigor_reserve": 2,
      "aggression": 0.65,
      "preferred_distance": 20
    },
    "master": {
      "think_interval_s": 0.55,
      "think_jitter": 0.2,
      "reaction_s": 0.2,
      "slip_chance": 0.55,
      "perfect_slip_chance": 0.5,
      "riposte_chance": 1.0,
      "combo_continue": 0.8,
      "break_slip_chance": 0.45,
      "tag_hp_pct": 0.4,
      "climax_chance": 1.0,
      "ignite_delay_s": 0.5,
      "uses_burst": true,
      "vigor_reserve": 2,
      "aggression": 0.75,
      "preferred_distance": 15
    }
  }
}
